{
  "candidate_id": "8b09a7dcad84c1bd",
  "candidate_kind": "AUTOTUNE_JIT",
  "capsule": {
    "path": "flaggems-34bd6d68/capsules/src/flag_gems/ops/grid_sample.py/L2485-L2676__grid_sample_3d_nearest_zeros_tiled_kernel__8b09a7dcad84c1bd.py",
    "resolver": "pipeguard_resolve",
    "sha256": "65cd75df1355052f94564e99d7c59f8fb7a5f3f79c925824bcba9d575ca3bdd0",
    "source_map": {
      "end_line": 2676,
      "logical_path": "src/flag_gems/ops/grid_sample.py",
      "start_line": 2485
    }
  },
  "decorators": [
    "flag_gems.utils.libentry",
    "triton.autotune",
    "triton.jit"
  ],
  "dsl": "triton",
  "free_names": [
    "libentry",
    "runtime",
    "tl",
    "triton"
  ],
  "kernel_dependencies": [],
  "lexical_parents": [],
  "recipe_paths": [
    "flaggems-34bd6d68/recipes/8b09a7dcad84c1bd/unresolved.json"
  ],
  "role": "UNCLASSIFIED",
  "schema_version": "pipeguard-upstream-capsule-v1",
  "unresolved_bindings": [],
  "upstream": {
    "commit": "34bd6d68928c8b0039c42987840929da52aa6a62",
    "end_line": 2676,
    "git_blob": "97916557aaa22e741b1e11d190ed0531b274f519",
    "qualname": "grid_sample_3d_nearest_zeros_tiled_kernel",
    "relative_path": "src/flag_gems/ops/grid_sample.py",
    "selected_source_sha256": "fd8e09731f966c6bace01ee33ab8b09a011ac96cd78353b6822117b77c8daa22",
    "source_sha256": "942d7b1371f46ed29592a5f3f788239001192e117667d943ffecdd7636c5600a",
    "start_line": 2485
  }
}
