{
  "candidate_id": "f537cb05da4462ae",
  "candidate_kind": "JIT_ENTRY",
  "capsule": {
    "path": "triton-61c02bcd/capsules/python/test/unit/language/test_core.py/L5637-L5639__test_num_warps_pow2._kernel__f537cb05da4462ae.py",
    "resolver": "pipeguard_resolve",
    "sha256": "430e3359212667dc77dfde0023d12b8d57a50778aa4e1c5a0e4ce34cea28cc14",
    "source_map": {
      "end_line": 5639,
      "logical_path": "python/test/unit/language/test_core.py",
      "start_line": 5637
    }
  },
  "decorators": [
    "triton.jit"
  ],
  "dsl": "triton",
  "free_names": [
    "triton"
  ],
  "kernel_dependencies": [],
  "lexical_parents": [
    "test_num_warps_pow2"
  ],
  "recipe_paths": [
    "triton-61c02bcd/recipes/f537cb05da4462ae/unresolved.json"
  ],
  "role": "ROOT",
  "schema_version": "pipeguard-upstream-capsule-v1",
  "unresolved_bindings": [],
  "upstream": {
    "commit": "61c02bcdba0ccc1cdfc89ba608aa1a1221a59e1f",
    "end_line": 5639,
    "git_blob": "37dbe1797a78cbd9838ebd53423b28fdb4b2bd8d",
    "qualname": "test_num_warps_pow2._kernel",
    "relative_path": "python/test/unit/language/test_core.py",
    "selected_source_sha256": "b394d188c3613154012e04b936fddb87e49712569127073aecd0114178303c1f",
    "source_sha256": "760bdbf74c105f9568cee2fd4e61c02daa14aa94dc32b4de4d708c68052f0292",
    "start_line": 5637
  }
}
