{
  "candidate_id": "f5f35ccebb4d03b3",
  "candidate_kind": "JIT_ENTRY",
  "capsule": {
    "path": "tilelang-2c31e071/capsules/testing/python/language/test_tilelang_language_reduce.py/L576-L588__test_reduce_local_packed_correctness.kernel__f5f35ccebb4d03b3.py",
    "resolver": "pipeguard_resolve",
    "sha256": "ee9d08a0a1bf0945186260536253fe6bd3d4158ff09f82415a1b317fa21a5c1a",
    "source_map": {
      "end_line": 588,
      "logical_path": "testing/python/language/test_tilelang_language_reduce.py",
      "start_line": 576
    }
  },
  "decorators": [
    "tilelang.jit"
  ],
  "dsl": "tilelang",
  "free_names": [
    "T",
    "_reduce_op",
    "op",
    "tilelang"
  ],
  "kernel_dependencies": [
    "1d30400bf1fe3027",
    "1ef6719fd209f75e",
    "25641f204c49631d",
    "5297e188815438e8",
    "79cd218b4c75c23e",
    "e15e30722e8f92af"
  ],
  "lexical_parents": [
    "test_reduce_local_packed_correctness"
  ],
  "recipe_paths": [
    "tilelang-2c31e071/recipes/f5f35ccebb4d03b3/unresolved.json"
  ],
  "role": "ROOT",
  "schema_version": "pipeguard-upstream-capsule-v1",
  "unresolved_bindings": [
    "batch",
    "dim",
    "dst",
    "kwargs",
    "op",
    "src"
  ],
  "upstream": {
    "commit": "2c31e071c626c0498b48dcdc2741dc8651b70dc1",
    "end_line": 588,
    "git_blob": "3ef7ddef9bbebf830c3e830bc98072d060c3ccb8",
    "qualname": "test_reduce_local_packed_correctness.kernel",
    "relative_path": "testing/python/language/test_tilelang_language_reduce.py",
    "selected_source_sha256": "4a6b61437b6d94207c71665fbbe5fd931b887a178126ce156111cae7d3790634",
    "source_sha256": "0c4cae5fc4c5346827ac4a53e880f6b55168e940440299b16a0dd96dc0fe68fc",
    "start_line": 576
  }
}
