{
  "candidate_id": "2046684122d9ed0c",
  "candidate_kind": "JIT_ENTRY",
  "capsule": {
    "path": "flaggems-34bd6d68/capsules/src/flag_gems/ops/xlogy.py/L25-L34__xlogy_compute__2046684122d9ed0c.py",
    "resolver": "pipeguard_resolve",
    "sha256": "b4e0a07e113fd9892d21d37fb6a191ea0ff786b47f88ab8ac07827c3d1cef144",
    "source_map": {
      "end_line": 34,
      "logical_path": "src/flag_gems/ops/xlogy.py",
      "start_line": 25
    }
  },
  "decorators": [
    "triton.jit"
  ],
  "dsl": "triton",
  "free_names": [
    "tl",
    "triton"
  ],
  "kernel_dependencies": [],
  "lexical_parents": [],
  "recipe_paths": [
    "flaggems-34bd6d68/recipes/2046684122d9ed0c/unresolved.json"
  ],
  "role": "HELPER",
  "schema_version": "pipeguard-upstream-capsule-v1",
  "unresolved_bindings": [],
  "upstream": {
    "commit": "34bd6d68928c8b0039c42987840929da52aa6a62",
    "end_line": 34,
    "git_blob": "4806bcf8ce297c8fe1f2c3b877a72457d5468210",
    "qualname": "_xlogy_compute",
    "relative_path": "src/flag_gems/ops/xlogy.py",
    "selected_source_sha256": "3c16ed4e85778ad48016803e04e46f08039c52ffeb657e6c5cee4d402ad42773",
    "source_sha256": "e28f19aa2d1e1db9531cf61eec6dddecda16547f00aacd52d09d85fa424325ef",
    "start_line": 25
  }
}
