{
  "candidate_id": "920b4f356c7b6973",
  "candidate_kind": "PRIMFUNC",
  "capsule": {
    "path": "tilelang-2c31e071/capsules/testing/python/cpu/test_tilelang_cpu_atomic.py/L172-L177__test_cpu_atomic_max_min_scalar.main__920b4f356c7b6973.py",
    "resolver": "pipeguard_resolve",
    "sha256": "e6ed578395106a6f9db79ad54148afa4aa3211d191dc192f18f7fda01c7e9a2c",
    "source_map": {
      "end_line": 177,
      "logical_path": "testing/python/cpu/test_tilelang_cpu_atomic.py",
      "start_line": 172
    }
  },
  "decorators": [
    "tilelang.language.prim_func"
  ],
  "dsl": "tilelang",
  "free_names": [
    "N",
    "T",
    "dtype",
    "emit"
  ],
  "kernel_dependencies": [],
  "lexical_parents": [
    "test_cpu_atomic_max_min_scalar"
  ],
  "recipe_paths": [
    "tilelang-2c31e071/recipes/920b4f356c7b6973/unresolved.json"
  ],
  "role": "UNCLASSIFIED",
  "schema_version": "pipeguard-upstream-capsule-v1",
  "unresolved_bindings": [
    "N",
    "dtype",
    "emit"
  ],
  "upstream": {
    "commit": "2c31e071c626c0498b48dcdc2741dc8651b70dc1",
    "end_line": 177,
    "git_blob": "e1c9b3c9b624a60ada78e8a95a928cddd155c806",
    "qualname": "test_cpu_atomic_max_min_scalar.main",
    "relative_path": "testing/python/cpu/test_tilelang_cpu_atomic.py",
    "selected_source_sha256": "4db6d376e2f20c0b45ea8520b9679388ba6f8e0206b8bf00631544e189d4062b",
    "source_sha256": "8c45b64df14c33d031fd496d39726b3e30dfa4cc6a0fb1d1fdb8411983f28483",
    "start_line": 172
  }
}
