{
  "candidate_id": "4e6a90eb23149413",
  "candidate_kind": "JIT_ENTRY",
  "capsule": {
    "path": "tilelang-2c31e071/capsules/examples/dsa_sparse_finetune/sparse_mla_bwd.py/L77-L251__bwd__4e6a90eb23149413.py",
    "resolver": "pipeguard_resolve",
    "sha256": "453d8cc8c9bfcb42ed495fbe1af039a7f139197452d39724b214c55120263718",
    "source_map": {
      "end_line": 251,
      "logical_path": "examples/dsa_sparse_finetune/sparse_mla_bwd.py",
      "start_line": 77
    }
  },
  "decorators": [
    "tilelang.jit"
  ],
  "dsl": "tilelang",
  "free_names": [
    "T",
    "tilelang"
  ],
  "kernel_dependencies": [],
  "lexical_parents": [],
  "recipe_paths": [
    "tilelang-2c31e071/recipes/4e6a90eb23149413/unresolved.json"
  ],
  "role": "UNCLASSIFIED",
  "schema_version": "pipeguard-upstream-capsule-v1",
  "unresolved_bindings": [],
  "upstream": {
    "commit": "2c31e071c626c0498b48dcdc2741dc8651b70dc1",
    "end_line": 251,
    "git_blob": "77cb37d6737e96f2b941e8794c1a89764cad9690",
    "qualname": "bwd",
    "relative_path": "examples/dsa_sparse_finetune/sparse_mla_bwd.py",
    "selected_source_sha256": "ddb86004657af49bb368e6f8727151870131b18c8126bd5ee52f9a1b61b46827",
    "source_sha256": "2c97c90e6a973bd3cf2951f3924b60dfcf16020d9d60dfd8c23e414543bd43c2",
    "start_line": 77
  }
}
